{"action_id":"operator.fixture","architecture":"x86_64","argv":["/opt/example.invalid/bin/synthetic-runner","--fixture"],"authority_digest":"sha256:1111111111111111111111111111111111111111111111111111111111111111","executable":{"path":"/opt/example.invalid/bin/synthetic-runner","sha256":"sha256:3333333333333333333333333333333333333333333333333333333333333333"},"execution_digest":"sha256:02e262e0114492b8078130e3b9f8c18244cb8d12c7f05224ff4b1012b411ac7c","expires_at":"2026-07-26T12:05:00Z","frames":[{"frame_type":2,"index":0,"length":18,"sha256":"sha256:8dd6df18f39390a986871f41f0f834c9642375d9b6d043fe4ff450bdb7095609"}],"issued_at":"2026-07-26T12:00:00Z","nonce":"AAAAAAAAAAAAAAAAAAAAAAAAAAAAAAAAAAAAAAAAAAA","operating_system":"linux","protocol_version":1,"required_privileges":[],"run_id":"123e4567-e89b-42d3-a456-426614174000","runner_identity":"runner.example.invalid","stderr_cap_bytes":4096,"stdout_cap_bytes":4096,"timeout_seconds":60}